{
  "$schema": "../../meta/schemas/core/store.schema.json",
  "id": "canon",
  "name": "Canon (World Bible)",
  "description": "Spoiler-level world truth: causes, timelines, secrets, faction motives, metaphysics. This is the lore bible that creative agents consult. NOT player-safe — contains information that would spoil the experience. Codex entries derive from canon but strip spoilers. Lore Weaver is the exclusive producer.",

  "semantics": "cold",

  "artifact_types": [
    "canon_pack"
  ],

  "workflow_intent": {
    "consumption_guidance": "all",
    "production_guidance": "exclusive",
    "designated_producers": ["lore_weaver"]
  },

  "retention": {
    "type": "forever"
  }
}
